{
  "protocol_version": "0.1",
  "evidence_channels": ["llm"],
  "request_id": "llm-review-agent-001",
  "status": "fail",
  "summary": {
    "issue_count": 1,
    "blocking_count": 1,
    "warning_count": 0,
    "note_count": 0
  },
  "issues": [
    {
      "segment_id": "seg-menu-start",
      "severity": "blocking",
      "category": "meaning",
      "message": "Target mistranslates the game start command.",
      "confidence": "medium",
      "channel": "llm",
      "suggested_target": "开始游戏"
    }
  ],
  "validation_items": []
}
